Authors,Title,Publication,Volume,Number,Pages,Year,Publisher
"Nishanth, J H; Balan, S; Rajith, R K",Fluoxetine induced acute urinary retention in a child with depression, The Primary Care Companion for CNS Disorders,,,,2022,
"Rajith, R K; Krishnakumar, P; ", Clinical profile of obsessive-compulsive disorder in children,Journal of Family Medicine and Primary Care,11,1,251-255,2022,Wolters Kluwer
"Balan, S; Ohnishi, T; Watanabe, A; Ohba, H; Iwayama, Y; Toyoshima, M; Hara, T; Hisano, Y; Miyasaka, Y; Toyota, T; ","Role of an atypical cadherin gene, Cdh23 in prepulse inhibition and implication of CDH23 in schizophrenia",Schizophrenia Bulletin,47,4,1190–1200,2021,Oxford University Press
"Hara, Tomonori; Toyoshima, Manabu; Hisano, Yasuko; Balan, Shabeesh; Iwayama, Yoshimi; Aono, Harumi; Futamura, Yushi; Osada, Hiroyuki; Owada, Yuji; Yoshikawa, Takeo; ",Glyoxalase I disruption and external carbonyl stress impair mitochondrial function in human induced pluripotent stem cells and derived neurons,Translational Psychiatry,11,1,1-12,2021,Nature Publishing Group
"Balan, Shabeesh; Iwayama, Yoshimi; Ohnishi, Tetsuo; Fukuda, Mikiko; Shirai, Atsuko; Yamada, Ayumi; Weirich, Sara; Schuhmacher, Maren Kirstin; Dileep, Kalarickal Vijayan; Endo, Toshihiro; ",A loss-of-function variant in SUV39H2 identified in autism-spectrum disorder causes altered H3K9 trimethylation and dysregulation of protocadherin β-cluster genes in the developing brain,Molecular Psychiatry,26,12,7550-7559,2021,Nature Publishing Group
